{
  "reporting_entity_name": "medicare",
  "reporting_entity_type": "medicare",
  "plan_name": "medicare",
  "plan_id_type": "HIOS",
  "plan_id": "12345XX9876543",
  "plan_market_type": "individual",
  "last_updated_on": "2020-08-27",
  "drugs": [{
    "drug_name": "Simvastatin", 
    "drug_type": "generic", 
    "ndc": "16729-004",
      
    "prices": [{ 
      "historical_net_price": 0.01,
      "historical_net_reporting_period": "2020-08-28",
      "negotiated_rate": 0.1,
      "administrative_fee": 0.02,
      "dispensing_fee": 2,
      "transaction_fee": 0.005,
      "tin": "11-1111111",
      "service_code": "01",
      "npi": [ 2222222222, 33333333333, 4444444444, 555555555 ],

      "pharmacies":[{
        "pharmacy_id_type": "ncpdp id",
        "pharmacy_ids": [ 1111111, 22222222, 3333333, 4444444 ]
      },{
        "pharmacy_id_type": "ncpdp chain code",
        "pharmacy_ids": [ 1111111, 22222222, 3333333, 4444444 ]
      },{
        "pharmacy_id_type": "npi",
        "pharmacy_ids": [ 111111111, 2222222222, 333333333, 444444444 ]
      }]

    }]
  }]
}
